<!--
  Copyright (C) Igor Sysoev
  Copyright (C) Nginx, Inc.
  -->

<!ELEMENT  i18n         (text+) >

<!ELEMENT  text         (item+) >
<!ATTLIST  text
           lang         CDATA #REQUIRED
>

<!ELEMENT  item         (#PCDATA) >
<!ATTLIST  item
           id           CDATA #REQUIRED
>
